keyword,title,authors,published,link,summary
Computer Vision,Vision Large Language Models Are Good Noise Handlers in Engagement Analysis,"Alexander Vedernikov, Puneet Kumar, Haoyu Chen, Tapio Seppänen, Xiaobai Li",2025-11-18,http://arxiv.org/abs/2511.14749v1,"Engagement recognition in video datasets, unlike traditional image classification tasks, is particularly challenged by subjective labels and noise limiting model performance. To overcome the challenges of subjective and noisy engagement labels, we propose a framework leveraging Vision Large Language Models (VLMs) to refine annotations and guide the training process. Our framework uses a questionna..."
Computer Vision,Cloud-Native Vector Search: A Comprehensive Performance Analysis,"Zhaoheng Li, Wei Ding, Silu Huang, Zikang Wang, Yuanjin Lin, Ke Wu, Yongjoo Park, Jianjun Chen",2025-11-18,http://arxiv.org/abs/2511.14748v1,"Vector search has been widely employed in recommender system and retrieval-augmented-generation pipelines, commonly performed with vector indexes to efficiently find similar items in large datasets. Recent growths in both data and task complexity have motivated placing vector indexes onto remote storage -- cloud-native vector search, which cloud providers have recently introduced services for. Yet..."
Computer Vision,Look-Ahead Reasoning on Learning Platforms,"Haiqing Zhu, Tijana Zrnic, Celestine Mendler-Dünner",2025-11-18,http://arxiv.org/abs/2511.14745v1,"On many learning platforms, the optimization criteria guiding model training reflect the priorities of the designer rather than those of the individuals they affect. Consequently, users may act strategically to obtain more favorable outcomes, effectively contesting the platform's predictions. While past work has studied strategic user behavior on learning platforms, the focus has largely been on s..."
Computer Vision,Measuring AI Progress in Drug Discovery: A Reproducible Leaderboard for the Tox21 Challenge,"Antonia Ebner, Christoph Bartmann, Sonja Topf, Sohvi Luukkonen, Johannes Schimunek, Günter Klambauer",2025-11-18,http://arxiv.org/abs/2511.14744v1,"Deep learning's rise since the early 2010s has transformed fields like computer vision and natural language processing and strongly influenced biomedical research. For drug discovery specifically, a key inflection - akin to vision's ""ImageNet moment"" - arrived in 2015, when deep neural networks surpassed traditional approaches on the Tox21 Data Challenge. This milestone accelerated the adoption of..."
Computer Vision,Beyond Means: A Dynamic Framework for Predicting Customer Satisfaction,"Christof Naumzik, Abdurahman Maarouf, Stefan Feuerriegel, Markus Weinmann",2025-11-18,http://arxiv.org/abs/2511.14743v1,"Online ratings influence customer decision-making, yet standard aggregation methods, such as the sample mean, fail to adapt to quality changes over time and ignore review heterogeneity (e.g., review sentiment, a review's helpfulness). To address these challenges, we demonstrate the value of using the Gaussian process (GP) framework for rating aggregation. Specifically, we present a tailored GP mod..."
Computer Vision,A Neural Field-Based Approach for View Computation & Data Exploration in 3D Urban Environments,"Stefan Cobeli, Kazi Shahrukh Omar, Rodrigo Valença, Nivan Ferreira, Fabio Miranda",2025-11-18,http://arxiv.org/abs/2511.14742v1,"Despite the growing availability of 3D urban datasets, extracting insights remains challenging due to computational bottlenecks and the complexity of interacting with data. In fact, the intricate geometry of 3D urban environments results in high degrees of occlusion and requires extensive manual viewpoint adjustments that make large-scale exploration inefficient. To address this, we propose a view..."
