keyword,title,authors,published,link,summary
RAG,Streamlining Industrial Contract Management with Retrieval-Augmented LLMs,"Kristi Topollai, Tolga Dimlioglu, Anna Choromanska, Simon Odie, Reginald Hui",2025-11-18,http://arxiv.org/abs/2511.14671v1,"Contract management involves reviewing and negotiating provisions, individual clauses that define rights, obligations, and terms of agreement. During this process, revisions to provisions are proposed and iteratively refined, some of which may be problematic or unacceptable. Automating this workflow is challenging due to the scarcity of labeled data and the abundance of unstructured legacy contrac..."
RAG,LiveRAG: A diverse Q&A dataset with varying difficulty level for RAG evaluation,"David Carmel, Simone Filice, Guy Horowitz, Yoelle Maarek, Alex Shtoff, Oren Somekh, Ran Tavory",2025-11-18,http://arxiv.org/abs/2511.14531v1,"With Retrieval Augmented Generation (RAG) becoming more and more prominent in generative AI solutions, there is an emerging need for systematically evaluating their effectiveness. We introduce the LiveRAG benchmark, a publicly available dataset of 895 synthetic questions and answers designed to support systematic evaluation of RAG-based Q&A systems. This synthetic benchmark is derived from the one..."
RAG,"Tell Me: An LLM-powered Mental Well-being Assistant with RAG, Synthetic Dialogue Generation, and Agentic Planning",Trishala Jayesh Ahalpara,2025-11-18,http://arxiv.org/abs/2511.14445v1,"We present Tell Me, a mental well-being system that leverages advances in large language models to provide accessible, context-aware support for users and researchers. The system integrates three components: (i) a retrieval-augmented generation (RAG) assistant for personalized, knowledge-grounded dialogue; (ii) a synthetic client-therapist dialogue generator conditioned on client profiles to facil..."
RAG,"SciRAG: Adaptive, Citation-Aware, and Outline-Guided Retrieval and Synthesis for Scientific Literature","Hang Ding, Yilun Zhao, Tiansheng Hu, Manasi Patwardhan, Arman Cohan",2025-11-18,http://arxiv.org/abs/2511.14362v1,"The accelerating growth of scientific publications has intensified the need for scalable, trustworthy systems to synthesize knowledge across diverse literature. While recent retrieval-augmented generation (RAG) methods have improved access to scientific information, they often overlook citation graph structure, adapt poorly to complex queries, and yield fragmented, hard-to-verify syntheses. We int..."
RAG,WebRec: Enhancing LLM-based Recommendations with Attention-guided RAG from Web,"Zihuai Zhao, Yujuan Ding, Wenqi Fan, Qing Li",2025-11-18,http://arxiv.org/abs/2511.14182v1,"Recommender systems play a vital role in alleviating information overload and enriching users' online experience. In the era of large language models (LLMs), LLM-based recommender systems have emerged as a prevalent paradigm for advancing personalized recommendations. Recently, retrieval-augmented generation (RAG) has drawn growing interest to facilitate the recommendation capability of LLMs, inco..."
RAG,NeuroPath: Neurobiology-Inspired Path Tracking and Reflection for Semantically Coherent Retrieval,"Junchen Li, Rongzheng Wang, Yihong Huang, Qizhi Chen, Jiasheng Zhang, Shuang Liang",2025-11-18,http://arxiv.org/abs/2511.14096v1,"Retrieval-augmented generation (RAG) greatly enhances large language models (LLMs) performance in knowledge-intensive tasks. However, naive RAG methods struggle with multi-hop question answering due to their limited capacity to capture complex dependencies across documents. Recent studies employ graph-based RAG to capture document connections. However, these approaches often result in a loss of se..."
RAG,Knowledge-Grounded Agentic Large Language Models for Multi-Hazard Understanding from Reconnaissance Reports,"Chenchen Kuai, Zihao Li, Braden Rosen, Stephanie Paan, Navid Jafari, Jean-Louis Briaud, Yunlong Zhang, Youssef M. A. Hashash, Yang Zhou",2025-11-18,http://arxiv.org/abs/2511.14010v1,"Post-disaster reconnaissance reports contain critical evidence for understanding multi-hazard interactions, yet their unstructured narratives make systematic knowledge transfer difficult. Large language models (LLMs) offer new potential for analyzing these reports, but often generate unreliable or hallucinated outputs when domain grounding is absent. This study introduces the Mixture-of-Retrieval ..."
RAG,Artificial Intelligence Agents in Music Analysis: An Integrative Perspective Based on Two Use Cases,"Antonio Manuel Martínez-Heredia, Dolores Godrid Rodríguez, Andrés Ortiz García",2025-11-17,http://arxiv.org/abs/2511.13987v1,"This paper presents an integrative review and experimental validation of artificial intelligence (AI) agents applied to music analysis and education. We synthesize the historical evolution from rule-based models to contemporary approaches involving deep learning, multi-agent architectures, and retrieval-augmented generation (RAG) frameworks. The pedagogical implications are evaluated through a dua..."
RAG,Automated Construction of Medical Indicator Knowledge Graphs Using Retrieval Augmented Large Language Models,"Zhengda Wang, Daqian Shi, Jingyi Zhao, Xiaolei Diao, Xiongfeng Tang, Yanguo Qin",2025-11-17,http://arxiv.org/abs/2511.13526v1,"Artificial intelligence (AI) is reshaping modern healthcare by advancing disease diagnosis, treatment decision-making, and biomedical research. Among AI technologies, large language models (LLMs) have become especially impactful, enabling deep knowledge extraction and semantic reasoning from complex medical texts. However, effective clinical decision support requires knowledge in structured, inter..."
RAG,PolicyBot - Reliable Question Answering over Policy Documents,"Gautam Nagarajan, Omir Kumar, Sudarsun Santhiappan",2025-11-17,http://arxiv.org/abs/2511.13489v1,"All citizens of a country are affected by the laws and policies introduced by their government. These laws and policies serve essential functions for citizens. Such as granting them certain rights or imposing specific obligations. However, these documents are often lengthy, complex, and difficult to navigate, making it challenging for citizens to locate and understand relevant information. This wo..."
RAG,Grounded by Experience: Generative Healthcare Prediction Augmented with Hierarchical Agentic Retrieval,"Chuang Zhao, Hui Tang, Hongke Zhao, Xiaofang Zhou, Xiaomeng Li",2025-11-17,http://arxiv.org/abs/2511.13293v1,"Accurate healthcare prediction is critical for improving patient outcomes and reducing operational costs. Bolstered by growing reasoning capabilities, large language models (LLMs) offer a promising path to enhance healthcare predictions by drawing on their rich parametric knowledge. However, LLMs are prone to factual inaccuracies due to limitations in the reliability and coverage of their embedded..."
RAG,Cog-RAG: Cognitive-Inspired Dual-Hypergraph with Theme Alignment Retrieval-Augmented Generation,"Hao Hu, Yifan Feng, Ruoxue Li, Rundong Xue, Xingliang Hou, Zhiqiang Tian, Yue Gao, Shaoyi Du",2025-11-17,http://arxiv.org/abs/2511.13201v1,"Retrieval-Augmented Generation (RAG) enhances the response quality and domain-specific performance of large language models (LLMs) by incorporating external knowledge to combat hallucinations. In recent research, graph structures have been integrated into RAG to enhance the capture of semantic relations between entities. However, it primarily focuses on low-order pairwise entity relations, limitin..."
RAG,Knowing Ourselves Through Others: Reflecting with AI in Digital Human Debates,"Ichiro Matsuda, Komichi Takezawa, Katsuhito Muroi, Kensuke Katori, Ryosuke Hyakuta, Jingjing Li, Yoichi Ochiai",2025-11-17,http://arxiv.org/abs/2511.13046v1,"LLMs can act as an impartial other, drawing on vast knowledge, or as personalized self-reflecting user prompts. These personalized LLMs, or Digital Humans, occupy an intermediate position between self and other. This research explores the dynamic of self and other mediated by these Digital Humans. Using a Research Through Design approach, nine junior and senior high school students, working in tea..."
RAG,RAGPulse: An Open-Source RAG Workload Trace to Optimize RAG Serving Systems,"Zhengchao Wang, Yitao Hu, Jianing Ye, Zhuxuan Chang, Jiazheng Yu, Youpeng Deng, Keqiu Li",2025-11-17,http://arxiv.org/abs/2511.12979v1,"Retrieval-Augmented Generation (RAG) is a critical paradigm for building reliable, knowledge-intensive Large Language Model (LLM) applications. However, the multi-stage pipeline (retrieve, generate) and unique workload characteristics (e.g., knowledge dependency) of RAG systems pose significant challenges for serving performance optimization. Existing generic LLM inference traces fail to capture t..."
RAG,TAdaRAG: Task Adaptive Retrieval-Augmented Generation via On-the-Fly Knowledge Graph Construction,"Jie Zhang, Bo Tang, Wanzi Shao, Wenqiang Wei, Jihao Zhao, Jianqing Zhu, Zhiyu li, Wen Xi, Zehao Lin, Feiyu Xiong, Yanchao Tan",2025-11-16,http://arxiv.org/abs/2511.12520v1,"Retrieval-Augmented Generation (RAG) improves large language models by retrieving external knowledge, often truncated into smaller chunks due to the input context window, which leads to information loss, resulting in response hallucinations and broken reasoning chains. Moreover, traditional RAG retrieves unstructured knowledge, introducing irrelevant details that hinder accurate reasoning. To addr..."
Retrieval-Augmented Generation,ARC Is a Vision Problem!,"Keya Hu, Ali Cy, Linlu Qiu, Xiaoman Delores Ding, Runqian Wang, Yeyin Eva Zhu, Jacob Andreas, Kaiming He",2025-11-18,http://arxiv.org/abs/2511.14761v1,"The Abstraction and Reasoning Corpus (ARC) is designed to promote research on abstract reasoning, a fundamental aspect of human intelligence. Common approaches to ARC treat it as a language-oriented problem, addressed by large language models (LLMs) or recurrent reasoning models. However, although the puzzle-like tasks in ARC are inherently visual, existing research has rarely approached the probl..."
Retrieval-Augmented Generation,UniGen-1.5: Enhancing Image Generation and Editing through Reward Unification in Reinforcement Learning,"Rui Tian, Mingfei Gao, Haiming Gang, Jiasen Lu, Zhe Gan, Yinfei Yang, Zuxuan Wu, Afshin Dehghan",2025-11-18,http://arxiv.org/abs/2511.14760v1,"We present UniGen-1.5, a unified multimodal large language model (MLLM) for advanced image understanding, generation and editing. Building upon UniGen, we comprehensively enhance the model architecture and training pipeline to strengthen the image understanding and generation capabilities while unlocking strong image editing ability. Especially, we propose a unified Reinforcement Learning (RL) str..."
Retrieval-Augmented Generation,$π^{*}_{0.6}$: a VLA That Learns From Experience,"Ali Amin, Raichelle Aniceto, Ashwin Balakrishna, Kevin Black, Ken Conley, Grace Connors, James Darpinian, Karan Dhabalia, Jared DiCarlo, Danny Driess, Michael Equi, Adnan Esmail, Yunhao Fang, Chelsea Finn, Catherine Glossop, Thomas Godden, Ivan Goryachev, Lachy Groom, Hunter Hancock, Karol Hausman, Gashon Hussein, Brian Ichter, Szymon Jakubczak, Rowan Jen, Tim Jones, Ben Katz, Liyiming Ke, Chandra Kuchi, Marinda Lamb, Devin LeBlanc, Sergey Levine, Adrian Li-Bell, Yao Lu, Vishnu Mano, Mohith Mothukuri, Suraj Nair, Karl Pertsch, Allen Z. Ren, Charvi Sharma, Lucy Xiaoyang Shi, Laura Smith, Jost Tobias Springenberg, Kyle Stachowicz, Will Stoeckle, Alex Swerdlow, James Tanner, Marcel Torne, Quan Vuong, Anna Walling, Haohuan Wang, Blake Williams, Sukwon Yoo, Lili Yu, Ury Zhilinsky, Zhiyuan Zhou",2025-11-18,http://arxiv.org/abs/2511.14759v1,"We study how vision-language-action (VLA) models can improve through real-world deployments via reinforcement learning (RL). We present a general-purpose method, RL with Experience and Corrections via Advantage-conditioned Policies (RECAP), that provides for RL training of VLAs via advantage conditioning. Our method incorporates heterogeneous data into the self-improvement process, including demon..."
Retrieval-Augmented Generation,Robust Verification of Controllers under State Uncertainty via Hamilton-Jacobi Reachability Analysis,"Albert Lin, Alessandro Pinto, Somil Bansal",2025-11-18,http://arxiv.org/abs/2511.14755v1,"As perception-based controllers for autonomous systems become increasingly popular in the real world, it is important that we can formally verify their safety and performance despite perceptual uncertainty. Unfortunately, the verification of such systems remains challenging, largely due to the complexity of the controllers, which are often nonlinear, nonconvex, learning-based, and/or black-box. Pr..."
Retrieval-Augmented Generation,Covering Barbasch-Vogan duality and wavefront sets of genuine representations,"Fan Gao, Baiying Liu, Chi-Heng Lo, Freydoon Shahidi",2025-11-18,http://arxiv.org/abs/2511.14750v1,"In this paper, we start by defining a covering Barbasch-Vogan duality and prove some of its properties. Then, for genuine representations of $p$-adic covering groups we formulate an upper bound conjecture for their wavefront sets using this covering Barbasch-Vogan duality and reduce it to anti-discrete representations. The formulation generalizes that of Ciubotaru-Kim and Hazeltine-Liu-Lo-Shahidi ..."
Retrieval-Augmented Generation,Cloud-Native Vector Search: A Comprehensive Performance Analysis,"Zhaoheng Li, Wei Ding, Silu Huang, Zikang Wang, Yuanjin Lin, Ke Wu, Yongjoo Park, Jianjun Chen",2025-11-18,http://arxiv.org/abs/2511.14748v1,"Vector search has been widely employed in recommender system and retrieval-augmented-generation pipelines, commonly performed with vector indexes to efficiently find similar items in large datasets. Recent growths in both data and task complexity have motivated placing vector indexes onto remote storage -- cloud-native vector search, which cloud providers have recently introduced services for. Yet..."
Retrieval-Augmented Generation,Pseudo-Poisson Distributions with Nonlinear Conditional Rates,Jared N. Lakhani,2025-11-18,http://arxiv.org/abs/2511.14741v1,"Arnold & Manjunath (2021) claim that the bivariate pseudo-Poisson distribution is well suited to bivariate count data with one equidispersed and one overdispersed marginal, owing to its parsimonious structure and straightforward parameter estimation. In the formulation of Leiter & Hamdan (1973), the conditional mean of $X_2$ was specified as a function of $X_1$; Arnold & Manjunath (2021) subsequen..."
Retrieval-Augmented Generation,LAUD: Integrating Large Language Models with Active Learning for Unlabeled Data,"Tzu-Hsuan Chou, Chun-Nan Chou",2025-11-18,http://arxiv.org/abs/2511.14738v1,"Large language models (LLMs) have shown a remarkable ability to generalize beyond their pre-training data, and fine-tuning LLMs can elevate performance to human-level and beyond. However, in real-world scenarios, lacking labeled data often prevents practitioners from obtaining well-performing models, thereby forcing practitioners to highly rely on prompt-based approaches that are often tedious, in..."
Retrieval-Augmented Generation,Squeezing-Enhanced Photon-Number Measurements for GKP State Generation,"Paul Renault, Patrick Yard, Raphael Pooser, Hussain Zaidi",2025-11-18,http://arxiv.org/abs/2511.14737v1,"We present an architecture for the generation of GKP states in which quadrature squeezing operations are used to control the average photon number statistics of probabilistic photon number measurements on Gaussian resource states. Specifically, we present an architecture employing a teleportation-based squeezing protocol and polynomial-gate applications integrated into a time-multiplexed multi-mod..."
Retrieval-Augmented Generation,Optimal bounds for sums of bounded arithmetic functions,"Andrés Chirre, Harald Andrés Helfgott",2025-11-18,http://arxiv.org/abs/2511.14736v1,Let $A(s) = \sum_n a_n n^{-s}$ be a Dirichlet series with meromorphic continuation. Say we are given information on the poles of $A(s)$ with $|\Im s| \leq T$ for some large constant $T$. What is the best way to use such finite spectral data to give explicit estimates on sums $\sum_{n\leq x} a_n$?   The problem of giving explicit bounds on the Mertens function $M(x) = \sum_{n\leq x} μ(n)$ illustrat...
Retrieval-Augmented Generation,Heterogeneous Multi-Agent Proximal Policy Optimization for Power Distribution System Restoration,"Parya Dolatyabi, Mahdi Khodayar",2025-11-18,http://arxiv.org/abs/2511.14730v1,"Restoring power distribution systems (PDS) after large-scale outages requires sequential switching operations that reconfigure feeder topology and coordinate distributed energy resources (DERs) under nonlinear constraints such as power balance, voltage limits, and thermal ratings. These challenges make conventional optimization and value-based RL approaches computationally inefficient and difficul..."
Retrieval-Augmented Generation,An Adaptive Proximal Point Method for Nonsmooth and Nonconvex Optimization on Hadamard Manifolds,"Vitaliano S. Amaral, Marcio Antônio de A. Bortoloti, Jurandir O. Lopes, Gilson N. Silva",2025-11-18,http://arxiv.org/abs/2511.14724v1,"This paper addresses a class of nonsmooth and nonconvex optimization problems defined on complete Riemannian manifolds. The objective function has a composite structure, combining convex, differentiable, and lower semicontinuous terms, thereby generalizing the classical framework of difference-of-convex programming. Motivated by recent advances in proximal point methods in Euclidean and Riemannian..."
Retrieval-Augmented Generation,When AI Democratizes Exploitation: LLM-Assisted Strategic Manipulation of Fair Division Algorithms,"Priyanka Verma, Balagopal Unnikrishnan",2025-11-18,http://arxiv.org/abs/2511.14722v1,"Fair resource division algorithms, like those implemented in Spliddit platform, have traditionally been considered difficult for the end users to manipulate due to its complexities. This paper demonstrates how Large Language Models (LLMs) can dismantle these protective barriers by democratizing access to strategic expertise. Through empirical analysis of rent division scenarios on Spliddit algorit..."
Retrieval-Augmented Generation,AdamHD: Decoupled Huber Decay Regularization for Language Model Pre-Training,"Fu-Ming Guo, Yingfang Fan",2025-11-18,http://arxiv.org/abs/2511.14721v1,"Adaptive optimizers with decoupled weight decay, such as AdamW, are the de facto standard for pre-training large transformer-based generative models. Yet the quadratic nature of the $\ell_2$ penalty embedded in weight decay drives all parameters toward the origin at the same rate, making the update vulnerable to rare but extreme gradient directions and often over-penalizing well-conditioned coordi..."
Retrieval-Augmented Generation,Zero-shot Synthetic Video Realism Enhancement via Structure-aware Denoising,"Yifan Wang, Liya Ji, Zhanghan Ke, Harry Yang, Ser-Nam Lim, Qifeng Chen",2025-11-18,http://arxiv.org/abs/2511.14719v1,"We propose an approach to enhancing synthetic video realism, which can re-render synthetic videos from a simulator in photorealistic fashion. Our realism enhancement approach is a zero-shot framework that focuses on preserving the multi-level structures from synthetic videos into the enhanced one in both spatial and temporal domains, built upon a diffusion video foundational model without further ..."
Computer Vision,ARC Is a Vision Problem!,"Keya Hu, Ali Cy, Linlu Qiu, Xiaoman Delores Ding, Runqian Wang, Yeyin Eva Zhu, Jacob Andreas, Kaiming He",2025-11-18,http://arxiv.org/abs/2511.14761v1,"The Abstraction and Reasoning Corpus (ARC) is designed to promote research on abstract reasoning, a fundamental aspect of human intelligence. Common approaches to ARC treat it as a language-oriented problem, addressed by large language models (LLMs) or recurrent reasoning models. However, although the puzzle-like tasks in ARC are inherently visual, existing research has rarely approached the probl..."
Computer Vision,UniGen-1.5: Enhancing Image Generation and Editing through Reward Unification in Reinforcement Learning,"Rui Tian, Mingfei Gao, Haiming Gang, Jiasen Lu, Zhe Gan, Yinfei Yang, Zuxuan Wu, Afshin Dehghan",2025-11-18,http://arxiv.org/abs/2511.14760v1,"We present UniGen-1.5, a unified multimodal large language model (MLLM) for advanced image understanding, generation and editing. Building upon UniGen, we comprehensively enhance the model architecture and training pipeline to strengthen the image understanding and generation capabilities while unlocking strong image editing ability. Especially, we propose a unified Reinforcement Learning (RL) str..."
Computer Vision,$π^{*}_{0.6}$: a VLA That Learns From Experience,"Ali Amin, Raichelle Aniceto, Ashwin Balakrishna, Kevin Black, Ken Conley, Grace Connors, James Darpinian, Karan Dhabalia, Jared DiCarlo, Danny Driess, Michael Equi, Adnan Esmail, Yunhao Fang, Chelsea Finn, Catherine Glossop, Thomas Godden, Ivan Goryachev, Lachy Groom, Hunter Hancock, Karol Hausman, Gashon Hussein, Brian Ichter, Szymon Jakubczak, Rowan Jen, Tim Jones, Ben Katz, Liyiming Ke, Chandra Kuchi, Marinda Lamb, Devin LeBlanc, Sergey Levine, Adrian Li-Bell, Yao Lu, Vishnu Mano, Mohith Mothukuri, Suraj Nair, Karl Pertsch, Allen Z. Ren, Charvi Sharma, Lucy Xiaoyang Shi, Laura Smith, Jost Tobias Springenberg, Kyle Stachowicz, Will Stoeckle, Alex Swerdlow, James Tanner, Marcel Torne, Quan Vuong, Anna Walling, Haohuan Wang, Blake Williams, Sukwon Yoo, Lili Yu, Ury Zhilinsky, Zhiyuan Zhou",2025-11-18,http://arxiv.org/abs/2511.14759v1,"We study how vision-language-action (VLA) models can improve through real-world deployments via reinforcement learning (RL). We present a general-purpose method, RL with Experience and Corrections via Advantage-conditioned Policies (RECAP), that provides for RL training of VLAs via advantage conditioning. Our method incorporates heterogeneous data into the self-improvement process, including demon..."
Computer Vision,"NeuCLIRBench: A Modern Evaluation Collection for Monolingual, Cross-Language, and Multilingual Information Retrieval","Dawn Lawrie, James Mayfield, Eugene Yang, Andrew Yates, Sean MacAvaney, Ronak Pradeep, Scott Miller, Paul McNamee, Luca Soldani",2025-11-18,http://arxiv.org/abs/2511.14758v1,"To measure advances in retrieval, test collections with relevance judgments that can faithfully distinguish systems are required. This paper presents NeuCLIRBench, an evaluation collection for cross-language and multilingual retrieval. The collection consists of documents written natively in Chinese, Persian, and Russian, as well as those same documents machine translated into English. The collect..."
Computer Vision,HMC: Learning Heterogeneous Meta-Control for Contact-Rich Loco-Manipulation,"Lai Wei, Xuanbin Peng, Ri-Zhao Qiu, Tianshu Huang, Xuxin Cheng, Xiaolong Wang",2025-11-18,http://arxiv.org/abs/2511.14756v1,"Learning from real-world robot demonstrations holds promise for interacting with complex real-world environments. However, the complexity and variability of interaction dynamics often cause purely positional controllers to struggle with contacts or varying payloads. To address this, we propose a Heterogeneous Meta-Control (HMC) framework for Loco-Manipulation that adaptively stitches multiple cont..."
Computer Vision,Robust Verification of Controllers under State Uncertainty via Hamilton-Jacobi Reachability Analysis,"Albert Lin, Alessandro Pinto, Somil Bansal",2025-11-18,http://arxiv.org/abs/2511.14755v1,"As perception-based controllers for autonomous systems become increasingly popular in the real world, it is important that we can formally verify their safety and performance despite perceptual uncertainty. Unfortunately, the verification of such systems remains challenging, largely due to the complexity of the controllers, which are often nonlinear, nonconvex, learning-based, and/or black-box. Pr..."
Computer Vision,SparseST: Exploiting Data Sparsity in Spatiotemporal Modeling and Prediction,"Junfeng Wu, Hadjer Benmeziane, Kaoutar El Maghraoui, Liu Liu, Yinan Wang",2025-11-18,http://arxiv.org/abs/2511.14753v1,"Spatiotemporal data mining (STDM) has a wide range of applications in various complex physical systems (CPS), i.e., transportation, manufacturing, healthcare, etc. Among all the proposed methods, the Convolutional Long Short-Term Memory (ConvLSTM) has proved to be generalizable and extendable in different applications and has multiple variants achieving state-of-the-art performance in various STDM..."
Computer Vision,A Sequential Operator-Splitting Framework for Exploration of Nonconvex Trajectory Optimization Solution Spaces,"Justin Ganiban, Natalia Pavlasek, Behcet Acikmese",2025-11-18,http://arxiv.org/abs/2511.14752v1,"Trajectory optimization methods provide an efficient and reliable means of computing feasible trajectories in nonconvex solution spaces. However, a well-known limitation of these algorithms is that they are inherently local in nature, and typically converge to a solution in the neighborhood of their initial guess. This paper presents a sequential operator-splitting framework, based on the alternat..."
Computer Vision,Co-Me: Confidence-Guided Token Merging for Visual Geometric Transformers,"Yutian Chen, Yuheng Qiu, Ruogu Li, Ali Agha, Shayegan Omidshafiei, Jay Patrikar, Sebastian Scherer",2025-11-18,http://arxiv.org/abs/2511.14751v1,"We propose Confidence-Guided Token Merging (Co-Me), an acceleration mechanism for visual geometric transformers without retraining or finetuning the base model. Co-Me distilled a light-weight confidence predictor to rank tokens by uncertainty and selectively merge low-confidence ones, effectively reducing computation while maintaining spatial coverage. Compared to similarity-based merging or pruni..."
